{
  "specVersion": "2.0.0",
  "specDate": "2026-08-10",
  "changelog": [
    {
      "version": "1.0",
      "date": "2025-08-29",
      "label": "Historical conceptual publication",
      "summary": "Original CSM publication. Four governance domains and sixteen original components.",
      "added": [
        "Four governance domains: Enterprise, Project, Code, UX",
        "Sixteen original components (four per domain)",
        "Cross-domain handoff visibility concept",
        "Implementation guidance (assessment, pilot, scale)",
        "Proportionality concept"
      ],
      "unchanged": []
    },
    {
      "version": "2.0.0",
      "date": "2026-08-10",
      "label": "Current specification",
      "summary": "Formalizes CSM into a deterministic governance operating model with machine-readable contracts.",
      "added": [
        "Two-axis operating architecture (Domains x Execution Functions)",
        "Governance Contract schema for every component",
        "Objective rules vs human judgment points",
        "Determinism contract",
        "Explicit state model (requirement, domain, system)",
        "Evidence schema with versioning",
        "Decision record schema",
        "Exception contract with expiration",
        "Formal handoff contracts",
        "Reassessment engine with deterministic triggers",
        "Component dependency graph",
        "4x6 operational mapping",
        "Governance depth / proportionality profiles",
        "Semantic versioning (spec, policy, assessment)",
        "Machine-readable specification design",
        "Informative NIST/ISO crosswalk"
      ],
      "unchanged": [
        "Four governance domains: Enterprise, Project, Code, UX",
        "Sixteen original components and their names",
        "Original provenance and publication reference",
        "Proportionality principle",
        "Handoff visibility as core value"
      ]
    }
  ],
  "domains": [
    {
      "id": "ENT",
      "displayName": "CSM-Enterprise",
      "shortName": "Enterprise",
      "tagline": "Establish the decision context before individual projects improvise it.",
      "centralQuestion": "Who has authority, who owns the outcome and risk, and what organizational boundaries apply?",
      "componentIds": [
        "ENT-POLICY",
        "ENT-RISK",
        "ENT-DATA",
        "ENT-MANDATE"
      ]
    },
    {
      "id": "PRJ",
      "displayName": "CSM-Project",
      "shortName": "Project",
      "tagline": "Make scaling an explicit governance decision.",
      "centralQuestion": "What evidence should justify continuing, changing, scaling or stopping an AI initiative?",
      "componentIds": [
        "PRJ-BUSINESS",
        "PRJ-TESTING",
        "PRJ-SCALE",
        "PRJ-PLAYBOOK"
      ]
    },
    {
      "id": "CODE",
      "displayName": "CSM-Code",
      "shortName": "Code",
      "tagline": "AI-generated code is still organizationally accountable code.",
      "centralQuestion": "How should software engineering governance change when AI contributes to implementation?",
      "componentIds": [
        "CODE-STANDARDS",
        "CODE-SECURITY",
        "CODE-HUMAN",
        "CODE-TRACE"
      ]
    },
    {
      "id": "UX",
      "displayName": "CSM-UX",
      "shortName": "UX",
      "tagline": "Governance reaches the people relying on the system.",
      "centralQuestion": "What do humans need to understand, supervise, challenge and appropriately use AI-supported outcomes?",
      "componentIds": [
        "UX-IMPACT",
        "UX-EXPLAIN",
        "UX-CAPABILITY",
        "UX-ADOPTION"
      ]
    }
  ],
  "components": [
    {
      "id": "ENT-POLICY",
      "domain": "ENT",
      "name": "Policy Framework",
      "description": "AI ethics standards and organizational policies that account for system behavior which may differ from conventional software."
    },
    {
      "id": "ENT-RISK",
      "domain": "ENT",
      "name": "Risk Assessment",
      "description": "Risk evaluation that accounts for system behavior which may change over time, including model updates, provider changes, or data drift."
    },
    {
      "id": "ENT-DATA",
      "domain": "ENT",
      "name": "Data Stewardship",
      "description": "Governance for datasets that influence ongoing AI behavior, including training data, retrieval sources and operational data."
    },
    {
      "id": "ENT-MANDATE",
      "domain": "ENT",
      "name": "Strategic Mandate",
      "description": "Organizational authority and strategic alignment that defines why AI systems are being deployed and what boundaries apply."
    },
    {
      "id": "PRJ-BUSINESS",
      "domain": "PRJ",
      "name": "Business Case Definition",
      "description": "What problem or value is being tested. The business case defines the hypothesis an AI initiative is evaluating."
    },
    {
      "id": "PRJ-TESTING",
      "domain": "PRJ",
      "name": "Controlled Testing",
      "description": "What must be learned before scale. Testing designed to answer specific governance and performance questions."
    },
    {
      "id": "PRJ-SCALE",
      "domain": "PRJ",
      "name": "Scale Decision Framework",
      "description": "What evidence justifies broader commitment. Defined criteria for deciding whether to proceed, change or stop."
    },
    {
      "id": "PRJ-PLAYBOOK",
      "domain": "PRJ",
      "name": "Playbook Documentation",
      "description": "What decisions and learning need to survive beyond the pilot team. Documentation that transfers knowledge to operational owners."
    },
    {
      "id": "CODE-STANDARDS",
      "domain": "CODE",
      "name": "Development Standards",
      "description": "Engineering standards that account for AI-assisted development, including review requirements and quality expectations."
    },
    {
      "id": "CODE-SECURITY",
      "domain": "CODE",
      "name": "Security Protocols",
      "description": "Security practices that address AI-generated code, including vulnerability scanning and dependency verification."
    },
    {
      "id": "CODE-HUMAN",
      "domain": "CODE",
      "name": "Human Oversight",
      "description": "Human review of AI-assisted contributions proportionate to risk and consequence."
    },
    {
      "id": "CODE-TRACE",
      "domain": "CODE",
      "name": "Traceability Logging",
      "description": "Records that provide appropriate provenance for AI-assisted changes where risk warrants it."
    },
    {
      "id": "UX-IMPACT",
      "domain": "UX",
      "name": "Impact Analysis",
      "description": "Assessment of how AI-supported outcomes affect individuals, groups and workflows."
    },
    {
      "id": "UX-EXPLAIN",
      "domain": "UX",
      "name": "Explainability Design",
      "description": "Design choices that help users understand system behavior, limitations and appropriate reliance."
    },
    {
      "id": "UX-CAPABILITY",
      "domain": "UX",
      "name": "Capability Development",
      "description": "Training and skill development that enables users to effectively supervise and interact with AI systems."
    },
    {
      "id": "UX-ADOPTION",
      "domain": "UX",
      "name": "Adoption Measurement",
      "description": "Monitoring of how AI systems are actually used, including feedback and complaints."
    }
  ],
  "executionFunctions": [
    {
      "id": "EF1-PURPOSE",
      "name": "Purpose, Scope & Accountability",
      "question": "What is the system for, who is accountable, and what boundaries apply?",
      "description": "Establishes the intended purpose, scope, ownership and accountability boundaries for the AI system."
    },
    {
      "id": "EF2-MAPPING",
      "name": "System, Data & Dependency Mapping",
      "question": "What components, data and dependencies comprise the system?",
      "description": "Maps the system architecture, data sources, model providers, tools and integrations."
    },
    {
      "id": "EF3-RISK",
      "name": "Risk, Evaluation & Monitoring",
      "question": "What risks exist and how are they evaluated and monitored?",
      "description": "Identifies, evaluates and continuously monitors risks including drift, performance and security."
    },
    {
      "id": "EF4-DELIVERY",
      "name": "Controlled Delivery & Change",
      "question": "How are changes controlled and delivered?",
      "description": "Governs the delivery pipeline, change management, testing gates and deployment controls."
    },
    {
      "id": "EF5-OVERSIGHT",
      "name": "Human Oversight, Feedback & Learning",
      "question": "How do humans oversee, provide feedback and learn from the system?",
      "description": "Ensures human oversight mechanisms, feedback channels and organizational learning loops."
    },
    {
      "id": "EF6-COMPLIANCE",
      "name": "Compliance, Evidence & Assurance",
      "question": "What evidence demonstrates governance and what compliance obligations apply?",
      "description": "Collects, organizes and produces evidence for governance assurance and regulatory obligations."
    }
  ],
  "governanceContracts": [
    {
      "id": "ENT-POLICY",
      "version": "2.0.0",
      "domain": "ENT",
      "name": "Policy Framework",
      "purpose": "Ensure AI ethics standards and organizational policies account for system behavior that may differ from conventional software.",
      "coreQuestion": "Are there organizational AI policies that apply to this system, and do they account for adaptive or probabilistic behavior?",
      "applicability": [
        {
          "field": "systemId",
          "operator": "exists",
          "description": "Applies to all AI-enabled systems."
        }
      ],
      "requiredInputs": [
        {
          "id": "aiPolicyDocumented",
          "label": "AI policy documented",
          "type": "boolean",
          "required": true,
          "description": "Whether organizational AI policies exist and are documented."
        },